link	title	keywords	characters	script	episode
https://youtu.be/3gP2GGt9mnc	La femelle du lièvre c'est la haze		bohort, karadoc	"- La femelle lièvre c'est la hase
- Non moi j'connais qu'le cri..."	L1T1E01 Heat
https://www.youtube.com/watch?v=ItUmHXMgIzg	Vous les voyez, vous ?		arthur, perceval	"- Vous les voyez, vous ?
- Non !
- Ah ben tourné vers là-bas c'est sûr, moi non plus j'vois rien !"	L1T1E01 Heat
https://www.youtube.com/watch?v=UfJJEfBLrM0	Ils sont encore là ces cons		leodagan	Ils sont encore là ces cons !	L1T1E01 Heat
https://www.youtube.com/watch?v=j4wwOEUFflo	Si ça se trouve		arthur	"""Si ça se trouve"" ! Alors pour nous sortir de là il va falloir un peu plus solide que du si ça se trouve !"	L1T1E01 Heat
https://www.youtube.com/watch?v=hfgauNbbzSM	On pourrait balancer d'la caillasse		perceval	On pourrait balancer d'la caillasse vers là-bas, comme ça ils s'disent qu'on y est et nous on part dans l'autre sens !	L1T1E01 Heat
https://www.youtube.com/watch?v=BeqUeG94Ctc	Laissez tomber les combines à deux ronds		arthur	Allons, s'il vous plaît, laissez tomber les combines à 2 ronds...	L1T1E01 Heat
https://www.youtube.com/watch?v=VopwQgMP-ms	Merde s'ils ont entendu mon plan c'est foutu		perceval, leodagan	Ils sont juste à côté ces cons-là.	L1T1E01 Heat
https://www.youtube.com/watch?v=admWKfclMqw	Animaux d'la forêt !		perceval	"Animaux de la forêt [imitations ratées de cris d'animaux]
Attendez ! [autres imitations ratées de cris d'animaux]"	L1T1E01 Heat